{
  "$schema": "https://json-schema.org/draft/2020-12/schema",
  "$id": "https://app-builder.local/contracts/schemas/v1/requirements.schema.json",
  "title": "Project Requirements",
  "type": "object",
  "required": ["schema_version", "project", "summary", "goals", "features", "constraints"],
  "properties": {
    "schema_version": { "const": "1.0" },
    "project": { "type": "string", "minLength": 1 },
    "summary": { "type": "string" },
    "goals": {
      "type": "array",
      "items": { "type": "string" },
      "default": []
    },
    "features": {
      "type": "array",
      "items": {
        "type": "object",
        "required": ["name"],
        "properties": {
          "name": { "type": "string", "minLength": 1 },
          "description": { "type": "string" }
        },
        "additionalProperties": true
      },
      "default": []
    },
    "constraints": {
      "type": "array",
      "items": { "type": "string" },
      "default": []
    }
  },
  "additionalProperties": true
}
